{
  "spec_version": "acp/1.0",
  "schema_version": 1,
  "event_id": "019de7eb-c0fe-7800-a000-000000000002",
  "event_type": "agent.response.delta",
  "occurred_at": "2026-05-02T10:00:00.456Z",
  "from": "main-agent",
  "to": "user-gateway",
  "correlation_id": "019de7eb-baab-7e67-bb77-a7a03a666140",
  "session_id": "sess_demo",
  "seq": 1,
  "payload": {"delta": "正在分析..."}
}
